Command	Alias	Hidden?	Ruling?	Response
omegavirus	omegaviruses, omega	FALSE		__**Omega Viruses**__ are the Omega versions of Mega Viruses and are even stronger than their original form: they can have higher stats/skills, improved Powers, and extra abilities.\n\nThe same rules and restrictions for Mega Viruses apply:  Omega Viruses are **not affected** by anything that only works on Viruses, and some may be controlled by **signal nodes** from afar.\n\nAll Omega Viruses drop their **MegaChip** when overcome (unless explicitly stated otherwise) - no roll necessary.
				
darkchip	darkchips	FALSE		**__DarkChips__** are destructive BattleChips connected to an outside entity - a **Daemon**. When a Navi uses a DarkChip, they have a choice - either **increase their Daemon Bond by 1** or perform their **Tribute**.\n\nDarkChips can only be used once. DarkChips have the same restrictions as MegaChips. However, when a Daemon puts a DarkChip in a Navi’s Folder, it ignores all Folder restrictions.\n\n**Signature DarkChips** can only be accessed by that Daemon.
tribute	tributes, daemontribute, daemontributes	FALSE		**__Tributes__** are destructive acts that temporarily sacrifice a Navi’s agency, letting the Daemon act through them. Tributes have long-lasting consequences that persist on jack-out.\n\nThe primary way to Tribute is by using a DarkChip and choosing to Tribute instead of increasing your Daemon Bond by 1. However, once the Navi has a **Bond Level 3** or higher with the Daemon, the Daemon can remotely trigger their Tribute. It won’t happen instantaneously - there will be warning signs, such as a creeping feeling, icy hands, or uncontrollable shivers. When a Daemon triggers a Tribute, it is almost certain to happen at the worst possible time.
chaosunison	chaosunisons, chaosunion, chaosunions	FALSE		**__ChaosUnisons__** are corruptions of the Bond Power CrossSoul. When a Navi with a Daemon Bond activates CrossSoul, instead of spending 3 Bond Points, they can **sacrifice a DarkChip to trigger a ChaosUnison**. ChaosUnisons still Cross with an ally and contain all the benefits of a CrossSoul, but with three additional effects:\n>>> 1. Gain the Daemon's ChaosUnison benefit.\n2. CrossSoul instead lasts for **2+[Daemon Bond Leve]x2** rolls.\n3. The Navi increases their Daemon Bond Level by 1 after it ends.
domain	domains, daemondomain, daemondomains	FALSE		**__Domains__** represent the feelings the Daemon preys on and what benefits it offers. Domains influence the kinds of DarkChips Daemons provide, how they influence NetOps and Navis, and its Tribute.
daemonbond	daemonbonds	FALSE		Each __**Daemon Bond**__ Level a NetOp gains with a Daemon increases the influence the Daemon has over the Navi, with increasingly severe effects. Unlike normal Bonds, **Daemon Bonds can exceed 3**. Bond Points from Daemons can be used for normal Bond Powers. However, Navis cannot CrossSoul with Daemons.\n\nWhen a player character has a Daemon Bond, they gain an extra step to Growing Up: **Subvert your Daemon’s desire**. Completing this step can take the place of one of the other three steps. When a player character completes three Growing Up steps including “Subvert your Daemon’s desire,” the Daemon Bond Level is **reduced by one**.\n\nUse `>help daemonbondex` to see the full list of Daemon Bond effects. Unless stated otherwise, the effect of each Bond Level stacks with the following levels.
daemonbondex	daemonbondexamples, daemonbondlist, daemonbonddetails, daemonbonddetail	TRUE		**Bond Level 1:** The Daemon can freely communicate with the NetOp and Navi via the PET, using whatever form or voice they choose.\n**Bond Level 2:** When the Navi rolls partial successes during ChaosUnison, the Daemon can choose to turn them into failures or full successes. The Daemon can also subtly manipulate the NetOp’s PET.\n**Bond Level 3:** The Daemon can remotely trigger a Tribute for any reason, or no reason at all.\n**Bond Level 4:** When the Navi uses a DarkChip, the NetOp must make an Easy Affinity roll to prevent the Daemon from taking control of the Navi.\n**Bond Level 5:** The Navi can ChaosUnison directly with the Daemon, adding 4 to every skill. DarkChip use now requires a Normal NetOp Affinity roll to prevent the Daemon from controlling the Navi.\n**Bond Level 6+:** The NetOp must make a Hard Affinity roll on jack-out, DarkChip use, and when a target is deleted. Failing this roll means the Daemon assumes total control of the Navi, likely permanently.
				
you		TRUE		Got a suggestion or would like to report an issue? Use `{cp}bugreport` to let us know, or contact the ProgBot development team!
me		TRUE		https://media1.tenor.com/images/b769654d59686712dead0d060f233341/tenor.gif?itemid=5613659